{
  "version": 1,
  "name": "work-agent-convergence",
  "description": "Initial extraction of convergence-style requirements from work-agent into Repo Standards vocabulary.",
  "rules": [
    {
      "id": "required-repo-artifacts",
      "kind": "required-artifacts",
      "classification": "hard-invariant",
      "stage": "block",
      "message": "Required repository governance and CI artifacts must exist.",
      "owner": "repo-core",
      "rollback_switch": null,
      "match": {
        "artifacts": [
          ".github/dependabot.yml",
          ".github/workflows/ci.yml",
          ".github/workflows/ci-extended.yml",
          ".github/ISSUE_TEMPLATE/bug-report.yml",
          ".github/ISSUE_TEMPLATE/feature-request.yml",
          ".github/ISSUE_TEMPLATE/docs-issue.yml",
          ".github/ISSUE_TEMPLATE/config.yml",
          ".github/pull_request_template.md",
          ".veritas/work-agent.repo-map.json",
          ".veritas/repo-standards/work-agent-convergence.repo-standards.json",
          "vendor/veritas/repo-maps/work-agent.repo-map.json",
          "vendor/veritas/repo-standards/work-agent-convergence.repo-standards.json",
          "docs/reference/contracts.md",
          "SECURITY.md"
        ]
      }
    },
    {
      "id": "baseline-evidence-check",
      "kind": "required-artifacts",
      "classification": "hard-invariant",
      "stage": "block",
      "message": "The primary PR workflow file must exist; deeper step-level checks live in CI itself.",
      "owner": "repo-core",
      "rollback_switch": null,
      "match": {
        "artifacts": [
          ".github/workflows/ci.yml"
        ]
      }
    },
    {
      "id": "forbid-shared-root-imports",
      "kind": "forbidden-pattern",
      "classification": "promotable-policy",
      "stage": "block",
      "message": "New code should not import from the @stallion-ai/shared root; use contracts or explicit helper subpaths.",
      "owner": "repo-architecture",
      "rollback_switch": "disable-shared-root-import-check",
      "match": {
        "files": [
          "packages/**/*.ts",
          "packages/**/*.tsx",
          "packages/**/*.mjs",
          "packages/**/*.js"
        ],
        "pattern": "@stallion-ai/shared(?!/)"
      }
    },
    {
      "id": "extracted-transport-helper-shape",
      "kind": "required-artifacts",
      "classification": "brittle-implementation-check",
      "stage": "recommend",
      "message": "Certain files currently assert exact extracted-helper source shapes; these should be reviewed for eventual replacement with stronger semantic checks.",
      "owner": "repo-architecture",
      "rollback_switch": "soften-source-shape-checks",
      "match": {
        "artifacts": [
          "packages/sdk/src/query-domains/systemRuntime.ts",
          "packages/sdk/src/query-domains/catalog.ts"
        ]
      }
    }
  ]
}
